{
  "schemaVersion": 2,
  "location": {
    "key": "lauchhammer",
    "name": "Lauchhammer",
    "latitude": 51.4693,
    "longitude": 13.76319
  },
  "status": "ok",
  "observations": {
    "temperatureHumidity": {
      "status": "ok",
      "statusReason": "latest CDC measurement is within freshness limit",
      "station": {
        "id": "02627",
        "name": "Schipkau-Klettwitz",
        "latitude": 51.5554,
        "longitude": 13.8845,
        "distanceKm": 12.7
      },
      "product": "10-minute air temperature / relative humidity / dew point / station pressure",
      "measuredAt": "2026-10-30T08:20:00Z",
      "measuredAtLocal": "2026-10-30T09:20:00+01:00",
      "retrievedAt": "2026-10-30T08:54:54Z",
      "retrievedAtLocal": "2026-10-30T09:54:54+01:00",
      "ageMinutes": 34.9,
      "freshnessThresholdMinutes": 60,
      "qualityLevel": 2,
      "units": {
        "temperatureC": "°C",
        "relativeHumidityPercent": "%",
        "dewPointC": "°C"
      },
      "values": {
        "temperatureC": 8.9,
        "relativeHumidityPercent": 87.3,
        "dewPointC": 6.9
      },
      "source": {
        "provider": "DWD Climate Data Center (CDC)",
        "url": "https://opendata.dwd.de/climate_environment/CDC/observations_germany/climate/10_minutes/air_temperature/now/10minutenwerte_TU_02627_now.zip",
        "license": "CC BY 4.0"
      },
      "invalidRowsSkipped": 0
    },
    "stationPressure": {
      "status": "ok",
      "statusReason": "latest CDC measurement is within freshness limit",
      "station": {
        "id": "01001",
        "name": "Doberlug-Kirchhain",
        "latitude": 51.6451,
        "longitude": 13.5747,
        "distanceKm": 23.5
      },
      "product": "10-minute station pressure",
      "measuredAt": "2026-10-30T08:20:00Z",
      "measuredAtLocal": "2026-10-30T09:20:00+01:00",
      "retrievedAt": "2026-10-30T08:54:54Z",
      "retrievedAtLocal": "2026-10-30T09:54:54+01:00",
      "ageMinutes": 34.9,
      "freshnessThresholdMinutes": 60,
      "qualityLevel": 2,
      "units": {
        "stationPressureHpa": "hPa"
      },
      "values": {
        "stationPressureHpa": 1020.5
      },
      "source": {
        "provider": "DWD Climate Data Center (CDC)",
        "url": "https://opendata.dwd.de/climate_environment/CDC/observations_germany/climate/10_minutes/air_temperature/now/10minutenwerte_TU_01001_now.zip",
        "license": "CC BY 4.0"
      },
      "invalidRowsSkipped": 0
    },
    "wind": {
      "status": "ok",
      "statusReason": "latest CDC measurement is within freshness limit",
      "station": {
        "id": "01001",
        "name": "Doberlug-Kirchhain",
        "latitude": 51.6451,
        "longitude": 13.5747,
        "distanceKm": 23.5
      },
      "product": "10-minute wind speed and direction",
      "measuredAt": "2026-10-30T08:20:00Z",
      "measuredAtLocal": "2026-10-30T09:20:00+01:00",
      "retrievedAt": "2026-10-30T08:54:54Z",
      "retrievedAtLocal": "2026-10-30T09:54:54+01:00",
      "ageMinutes": 34.9,
      "freshnessThresholdMinutes": 60,
      "qualityLevel": 2,
      "units": {
        "windSpeedKmh": "km/h",
        "windDirectionDeg": "degree"
      },
      "values": {
        "windSpeedKmh": 6.48,
        "windDirectionDeg": 30.0
      },
      "source": {
        "provider": "DWD Climate Data Center (CDC)",
        "url": "https://opendata.dwd.de/climate_environment/CDC/observations_germany/climate/10_minutes/wind/now/10minutenwerte_wind_01001_now.zip",
        "license": "CC BY 4.0"
      },
      "invalidRowsSkipped": 0
    },
    "windGust": {
      "status": "ok",
      "statusReason": "latest CDC measurement is within freshness limit",
      "station": {
        "id": "01001",
        "name": "Doberlug-Kirchhain",
        "latitude": 51.6451,
        "longitude": 13.5747,
        "distanceKm": 23.5
      },
      "product": "10-minute extreme wind (maximum gust)",
      "measuredAt": "2026-10-30T08:20:00Z",
      "measuredAtLocal": "2026-10-30T09:20:00+01:00",
      "retrievedAt": "2026-10-30T08:54:54Z",
      "retrievedAtLocal": "2026-10-30T09:54:54+01:00",
      "ageMinutes": 34.9,
      "freshnessThresholdMinutes": 60,
      "qualityLevel": 2,
      "units": {
        "windGustKmh": "km/h"
      },
      "values": {
        "windGustKmh": 10.44
      },
      "source": {
        "provider": "DWD Climate Data Center (CDC)",
        "url": "https://opendata.dwd.de/climate_environment/CDC/observations_germany/climate/10_minutes/extreme_wind/now/10minutenwerte_extrema_wind_01001_now.zip",
        "license": "CC BY 4.0"
      },
      "invalidRowsSkipped": 0
    },
    "precipitation": {
      "status": "ok",
      "statusReason": "latest CDC measurement is within freshness limit",
      "station": {
        "id": "02627",
        "name": "Schipkau-Klettwitz",
        "latitude": 51.5554,
        "longitude": 13.8845,
        "distanceKm": 12.7
      },
      "product": "10-minute precipitation sum",
      "measuredAt": "2026-10-30T08:20:00Z",
      "measuredAtLocal": "2026-10-30T09:20:00+01:00",
      "retrievedAt": "2026-10-30T08:54:54Z",
      "retrievedAtLocal": "2026-10-30T09:54:54+01:00",
      "ageMinutes": 34.9,
      "freshnessThresholdMinutes": 60,
      "qualityLevel": 2,
      "units": {
        "precipitation10MinMm": "mm"
      },
      "values": {
        "precipitation10MinMm": 0.0
      },
      "source": {
        "provider": "DWD Climate Data Center (CDC)",
        "url": "https://opendata.dwd.de/climate_environment/CDC/observations_germany/climate/10_minutes/precipitation/now/10minutenwerte_nieder_02627_now.zip",
        "license": "CC BY 4.0"
      },
      "invalidRowsSkipped": 0
    }
  },
  "forecast": {
    "provider": "Deutscher Wetterdienst (DWD), MOSMIX-L",
    "status": "ok",
    "statusReason": "latest DWD MOSMIX-L run within freshness limit",
    "stationId": "P0043",
    "stationName": "SENFTENBERG/LUB",
    "coordinates": {
      "latitude": 51.52,
      "longitude": 14.0
    },
    "distanceKm": 17.34,
    "issuedAt": "2026-10-30T03:00:00Z",
    "issuedAtLocal": "2026-10-30T04:00:00+01:00",
    "retrievedAt": "2026-10-30T08:54:54Z",
    "retrievedAtLocal": "2026-10-30T09:54:54+01:00",
    "ageHours": 5.92,
    "models": [
      {
        "name": "ICON",
        "referenceTime": "2026-10-30T00:00:00Z"
      },
      {
        "name": "ECMWF/IFS",
        "referenceTime": "2026-10-29T12:00:00Z"
      }
    ],
    "points": [
      {
        "validAt": "2026-10-30T04:00:00Z",
        "validAtLocal": "2026-10-30T05:00:00+01:00",
        "values": {
          "temperatureC": 7.6,
          "windDirectionDeg": 357,
          "windSpeedKmh": 3.71,
          "windGustKmh": 7.42,
          "precipitation1hMm": 0,
          "pressureHpa": 1031.5,
          "weatherCode": 3,
          "weatherSymbol": "cloud"
        }
      },
      {
        "validAt": "2026-10-30T05:00:00Z",
        "validAtLocal": "2026-10-30T06:00:00+01:00",
        "values": {
          "temperatureC": 7.1,
          "windDirectionDeg": 355,
          "windSpeedKmh": 3.71,
          "windGustKmh": 7.42,
          "precipitation1hMm": 0,
          "pressureHpa": 1031.6,
          "weatherCode": 3,
          "weatherSymbol": "cloud"
        }
      },
      {
        "validAt": "2026-10-30T06:00:00Z",
        "validAtLocal": "2026-10-30T07:00:00+01:00",
        "values": {
          "temperatureC": 7.0,
          "windDirectionDeg": 346,
          "windSpeedKmh": 3.71,
          "windGustKmh": 7.42,
          "precipitation1hMm": 0,
          "pressureHpa": 1031.9,
          "weatherCode": 3,
          "weatherSymbol": "cloud"
        }
      },
      {
        "validAt": "2026-10-30T07:00:00Z",
        "validAtLocal": "2026-10-30T08:00:00+01:00",
        "values": {
          "temperatureC": 7.2,
          "windDirectionDeg": 349,
          "windSpeedKmh": 3.71,
          "windGustKmh": 9.25,
          "precipitation1hMm": 0,
          "pressureHpa": 1032.1,
          "weatherCode": 3,
          "weatherSymbol": "cloud"
        }
      },
      {
        "validAt": "2026-10-30T08:00:00Z",
        "validAtLocal": "2026-10-30T09:00:00+01:00",
        "values": {
          "temperatureC": 7.7,
          "windDirectionDeg": 347,
          "windSpeedKmh": 5.54,
          "windGustKmh": 9.25,
          "precipitation1hMm": 0,
          "pressureHpa": 1032.4,
          "weatherCode": 3,
          "weatherSymbol": "cloud"
        }
      },
      {
        "validAt": "2026-10-30T09:00:00Z",
        "validAtLocal": "2026-10-30T10:00:00+01:00",
        "values": {
          "temperatureC": 8.4,
          "windDirectionDeg": 349,
          "windSpeedKmh": 5.54,
          "windGustKmh": 11.12,
          "precipitation1hMm": 0,
          "pressureHpa": 1032.4,
          "weatherCode": 3,
          "weatherSymbol": "cloud"
        }
      },
      {
        "validAt": "2026-10-30T10:00:00Z",
        "validAtLocal": "2026-10-30T11:00:00+01:00",
        "values": {
          "temperatureC": 9.2,
          "windDirectionDeg": 348,
          "windSpeedKmh": 5.54,
          "windGustKmh": 11.12,
          "precipitation1hMm": 0,
          "pressureHpa": 1032.3,
          "weatherCode": 3,
          "weatherSymbol": "cloud"
        }
      },
      {
        "validAt": "2026-10-30T11:00:00Z",
        "validAtLocal": "2026-10-30T12:00:00+01:00",
        "values": {
          "temperatureC": 9.8,
          "windDirectionDeg": 339,
          "windSpeedKmh": 5.54,
          "windGustKmh": 12.96,
          "precipitation1hMm": 0,
          "pressureHpa": 1032.1,
          "weatherCode": 3,
          "weatherSymbol": "cloud"
        }
      },
      {
        "validAt": "2026-10-30T12:00:00Z",
        "validAtLocal": "2026-10-30T13:00:00+01:00",
        "values": {
          "temperatureC": 10.0,
          "windDirectionDeg": 331,
          "windSpeedKmh": 7.42,
          "windGustKmh": 12.96,
          "precipitation1hMm": 0,